{
  "schema_version": 1,
  "pack_id": "softpowers-matched",
  "description": "Matched Softpowers comparison between a pinned baseline skill snapshot and the current generated candidate tree.",
  "cases_root": "evals/cases",
  "subjects": {
    "softpowers-baseline": {
      "label": "Pinned baseline Softpowers skills",
      "attribution": "repo_scoped",
      "overlays": [
        {
          "source": ".fieldlab-subjects/baseline-skills",
          "target": ".agents/skills"
        }
      ],
      "notes": "Materialize with fieldlab snapshot-git before validation."
    },
    "softpowers-candidate": {
      "label": "Current generated Softpowers skills",
      "attribution": "repo_scoped",
      "overlays": [
        {
          "source": "skills",
          "target": ".agents/skills"
        }
      ],
      "notes": "Build and sync the current generated skill tree before planning."
    }
  },
  "defaults": {
    "adapter": "codex-exec",
    "approval_policy": "never",
    "network_access": false,
    "output_root": ".fieldlab",
    "keep_workspace": false
  },
  "metadata": {
    "source_revision": "b2d1631c9bbfad0822d062fadd5adb1a04324fe9",
    "baseline_snapshot_root": ".fieldlab-subjects/baseline-skills"
  }
}
