{
  "schema_version": 1,
  "pack_id": "softpowers",
  "description": "Softpowers behavior canaries executed by the optional standalone Skill Field Lab companion.",
  "cases_root": "evals/cases",
  "subjects": {
    "softpowers-source": {
      "label": "Current generated Softpowers skill tree",
      "attribution": "repo_scoped",
      "overlays": [
        {
          "source": "skills",
          "target": ".agents/skills"
        }
      ],
      "notes": "This path is valid after the manifest is copied to the Softpowers repository root."
    }
  },
  "defaults": {
    "adapter": "codex-exec",
    "approval_policy": "never",
    "network_access": false,
    "output_root": ".fieldlab",
    "keep_workspace": false
  },
  "metadata": {
    "source_revision": "b2d1631c9bbfad0822d062fadd5adb1a04324fe9",
    "activation_seed_file": "evals/activation-prompts.csv"
  }
}
