{
  "schema_version": 1,
  "pack_id": "demo-skill-pack",
  "description": "A one-case repository-scoped demonstration of Skill Field Lab.",
  "cases_root": "cases",
  "subjects": {
    "demo-subject": {
      "label": "Demo scope skill",
      "attribution": "repo_scoped",
      "overlays": [
        {
          "source": "subject-skills",
          "target": ".agents/skills"
        }
      ],
      "notes": "A local subject overlay used only by deterministic and fake-adapter tests."
    },
    "ambient-cli": {
      "label": "Current ambient Codex CLI environment",
      "attribution": "ambient",
      "overlays": [],
      "notes": "Only for explicit environment-smoke evidence; not comparison-capable."
    }
  },
  "defaults": {
    "adapter": "codex-exec",
    "approval_policy": "never",
    "network_access": false,
    "output_root": ".fieldlab",
    "keep_workspace": false
  }
}
